{
  "pipeline_name": "Main CI",
  "build_number": "20240102.1",
  "status": "completed",
  "result": "succeeded",
  "branch": "main",
  "finish_time": "2024-01-02T12:00:00Z",
  "summary": "Build succeeded. All 150 tests passed.",
  "portal_url": "https://dev.azure.com/org/proj/_build/results?buildId=12346"
}
